{
  "event_id": "evt-denied-guest-access-001",
  "timestamp": "2026-01-01T00:00:00Z",
  "event_type": "network_flow",
  "source_zone": "branch-guest-client",
  "destination_zone": "branch-local-service",
  "source_service": "branch-guest-client",
  "destination_service": "branch-local-service",
  "protocol": "tcp",
  "port": "any",
  "action": "deny",
  "service": "restricted branch service reachability",
  "rationale": "Guest traffic must not reach restricted branch services by default.",
  "flow_id": "D2",
  "severity": "medium",
  "environment": "local",
  "validation_status": "planned",
  "metadata": {
    "source_contract": "network-security/segmentation/flows.yaml",
    "scenario": "guest-to-internal-access",
    "implementation_note": "Sample event only; not generated by a running topology yet."
  }
}
